{
  "$schema": "../FormMetadata.json",
  "datasets": [
    "csv",
    "excel",
    "spss"
  ],
  "permissions": {
    "datasets": "pXX-member-group",
    "api": [
      "pXX-core-group",
      "pXX-admin-group"
    ]
  },
  "activatedOn": "timestamp",
  "activatedBy": "pxx-user",
  "deactivatedOn": "timestamp",
  "deactivatedBy": "pxx-user",
  "active": true,
  "isConsentForm": true,
  "questions": [
    {
      "id": 1111,
      "text": "What do you ..",
      "questionType": "checkBox",
      "codebookCode": "question_1",
      "isIDQuestion": "no",
      "isConsentQuestion": true
    }
  ]
}